{"artifact_id":"artifact:705163c2d401e60115dce5bd457d8e31d77b275ff155205cbefd58a6cf68f7d9","format_version":2,"node_types":{"narrata.call":"2","narrata.mutate":"2","narrata.passage":"2","narrata.return":"2"},"packages":{"camp":{"digest":"49aa7f3ea83d1ed2d1294526efc6986ceef2f27fc709f3b2c64dd3fa9004f464","id":"example.mountain-camp","version":"1.0.0"},"main":{"digest":"caa5027670fe9e9dc29e716dbeba47e3ad65b8974a99848e3b811fd82d761bd5","id":"example.mountain-main","version":"1.0.0"},"road":{"digest":"926a032c94293201f2fc7edebbe2aa0a3ff1857580df9e00db46271e96e1a7cf","id":"example.mountain-road","version":"1.0.0"}}}